{"componentChunkName":"component---src-templates-meeting-agenda-tsx","path":"/meetings/agendas/2021/May/20/Quarterly-Neighborhood/","result":{"data":{"mdx":{"frontmatter":{"starts":"05-20-2021 07:00 PM","ends":"05-20-2021 08:00 PM","type":"Quarterly Neighborhood","location":"Newell Playground","meetingID":null,"meetingPasscode":null,"meetingPhone":null,"meetingUrl":null,"author":"Brad Candell","address":"122 S. Michigan Street","city":"Eau Claire","state":"WI","postalCode":54703},"body":"function _extends() { _extends = Object.assign || function (target) { for (var i = 1; i < arguments.length; i++) { var source = arguments[i]; for (var key in source) { if (Object.prototype.hasOwnProperty.call(source, key)) { target[key] = source[key]; } } } return target; }; return _extends.apply(this, arguments); }\n\nfunction _objectWithoutProperties(source, excluded) { if (source == null) return {}; var target = _objectWithoutPropertiesLoose(source, excluded); var key, i; if (Object.getOwnPropertySymbols) { var sourceSymbolKeys = Object.getOwnPropertySymbols(source); for (i = 0; i < sourceSymbolKeys.length; i++) { key = sourceSymbolKeys[i]; if (excluded.indexOf(key) >= 0) continue; if (!Object.prototype.propertyIsEnumerable.call(source, key)) continue; target[key] = source[key]; } } return target; }\n\nfunction _objectWithoutPropertiesLoose(source, excluded) { if (source == null) return {}; var target = {}; var sourceKeys = Object.keys(source); var key, i; for (i = 0; i < sourceKeys.length; i++) { key = sourceKeys[i]; if (excluded.indexOf(key) >= 0) continue; target[key] = source[key]; } return target; }\n\n/* @jsxRuntime classic */\n\n/* @jsx mdx */\nvar _frontmatter = {\n  \"starts\": \"05-20-2021 07:00 PM\",\n  \"ends\": \"05-20-2021 08:00 PM\",\n  \"type\": \"Quarterly Neighborhood\",\n  \"location\": \"Newell Playground\",\n  \"author\": \"Brad Candell\",\n  \"address\": \"122 S. Michigan Street\",\n  \"city\": \"Eau Claire\",\n  \"state\": \"WI\",\n  \"postalCode\": 54703\n};\nvar layoutProps = {\n  _frontmatter: _frontmatter\n};\nvar MDXLayout = \"wrapper\";\nreturn function MDXContent(_ref) {\n  var components = _ref.components,\n      props = _objectWithoutProperties(_ref, [\"components\"]);\n\n  return mdx(MDXLayout, _extends({}, layoutProps, props, {\n    components: components,\n    mdxType: \"MDXLayout\"\n  }), mdx(\"ol\", null, mdx(\"li\", {\n    parentName: \"ol\"\n  }, \"Welcome and Call to Order\"), mdx(\"li\", {\n    parentName: \"ol\"\n  }, \"Steering Committee Introductions\"), mdx(\"li\", {\n    parentName: \"ol\"\n  }, \"Association Updates\", mdx(\"ol\", {\n    parentName: \"li\"\n  }, mdx(\"li\", {\n    parentName: \"ol\"\n  }, \"Treasurer's Report\"), mdx(\"li\", {\n    parentName: \"ol\"\n  }, \"Upcoming Meetings\"), mdx(\"li\", {\n    parentName: \"ol\"\n  }, \"Clean Up\"), mdx(\"li\", {\n    parentName: \"ol\"\n  }, \"Tree Planting\"), mdx(\"li\", {\n    parentName: \"ol\"\n  }, \"Bowl for Kids' Sake\"))), mdx(\"li\", {\n    parentName: \"ol\"\n  }, \"Sub-Committee Updates\", mdx(\"ol\", {\n    parentName: \"li\"\n  }, mdx(\"li\", {\n    parentName: \"ol\"\n  }, \"Communications\"), mdx(\"li\", {\n    parentName: \"ol\"\n  }, \"Parks & Recreation\"))), mdx(\"li\", {\n    parentName: \"ol\"\n  }, \"Neighborhood Updates\", mdx(\"ol\", {\n    parentName: \"li\"\n  }, mdx(\"li\", {\n    parentName: \"ol\"\n  }, \"Neighborhood-wide Thrift Sale\"), mdx(\"li\", {\n    parentName: \"ol\"\n  }, \"Elections\"))), mdx(\"li\", {\n    parentName: \"ol\"\n  }, \"Open Discussion\"), mdx(\"li\", {\n    parentName: \"ol\"\n  }, \"Adjournment\")), mdx(\"p\", null, mdx(\"strong\", {\n    parentName: \"p\"\n  }, \"Please Note:\"), \" This is the first in-person meeting scheduled since February of 2020.\"), mdx(\"p\", null, \"Please see the information below about attending this meeting and any expectations for masks and social distancing.\\nPlease use your discretion and only attend if you are feeling well and have not been in contact\\nwith anyone who has been diagnosed with COVID-19.\"), mdx(\"p\", null, \"Also, we encourage those who are able to \", mdx(\"strong\", {\n    parentName: \"p\"\n  }, \"bring a lawn chair\"), \" because seating is extremely limited.\"), mdx(\"h2\", null, \"Association Updates\"), mdx(\"h3\", null, \"Treasurer's Report\"), mdx(\"ul\", null, mdx(\"li\", {\n    parentName: \"ul\"\n  }, \"Current Balance: \", mdx(\"strong\", {\n    parentName: \"li\"\n  }, \"$ 3411.13\")), mdx(\"li\", {\n    parentName: \"ul\"\n  }, \"Accounting\", mdx(\"ul\", {\n    parentName: \"li\"\n  }, mdx(\"li\", {\n    parentName: \"ul\"\n  }, \"February (\", mdx(\"strong\", {\n    parentName: \"li\"\n  }, \"$ 0.00\"), \" in deposits | \", mdx(\"strong\", {\n    parentName: \"li\"\n  }, \"$ 0.00\"), \" in expenses)\"), mdx(\"li\", {\n    parentName: \"ul\"\n  }, \"March (\", mdx(\"strong\", {\n    parentName: \"li\"\n  }, \"$ 0.00\"), \" in deposits | \", mdx(\"strong\", {\n    parentName: \"li\"\n  }, \"$ 0.00\"), \" in expenses)\"), mdx(\"li\", {\n    parentName: \"ul\"\n  }, \"April (\", mdx(\"strong\", {\n    parentName: \"li\"\n  }, \"$ 0.00\"), \" in deposits | \", mdx(\"strong\", {\n    parentName: \"li\"\n  }, \"$ 0.00\"), \" in expenses)\"), mdx(\"li\", {\n    parentName: \"ul\"\n  }, \"May (\", mdx(\"strong\", {\n    parentName: \"li\"\n  }, \"$ 0.00\"), \" in deposits | \", mdx(\"strong\", {\n    parentName: \"li\"\n  }, \"$ 0.00\"), \" in expenses)\")))), mdx(\"h3\", null, \"Meetings\"), mdx(\"p\", null, \"The Steering Committee has voted (electronically) in favor of conducting this Quarterly Neighborhood Meeting in-person at Newell Playground with\\nappropriate social distancing and mask rules. We recognize that meeting virtually has unfortunately excluded some members of our community\\nwho are unable to participate and thank you all for accommodating us the best you could through these unprecedented times.\"), mdx(\"p\", null, \"Please use your best judgement when deciding if participating is in the best interest of you, your family and your neighbors. If you are not\\nfeeling well on the day of the meeting, it is recommended that you avoid joining the rest of the Neighborhood until a later date when you are feeling\\nbetter.\"), mdx(\"p\", null, \"At this time we will continue holding the monthly Steering Committee meetings virtually and will evaluate the state of the pandemic for our next Quarterly\\nMeeting scheduled for \", mdx(\"strong\", {\n    parentName: \"p\"\n  }, \"August 19th, 2021\"), \".\"), mdx(\"h4\", null, \"Upcoming Steering Committee Meetings\"), mdx(\"p\", null, \"Steering Committee meetings are held on the 3rd Thursday of each month, when there is not otherwise a Quarterly meeting scheduled.\"), mdx(\"p\", null, \"The next Steering Committee meetings will be held on:\"), mdx(\"ul\", null, mdx(\"li\", {\n    parentName: \"ul\"\n  }, mdx(\"strong\", {\n    parentName: \"li\"\n  }, \"Thursday, June 17th\")), mdx(\"li\", {\n    parentName: \"ul\"\n  }, mdx(\"strong\", {\n    parentName: \"li\"\n  }, \"Thursday, July 15th\"))), mdx(\"h4\", null, \"Upcoming Quarterly Meeting\"), mdx(\"p\", null, \"Our next Quarterly meeting will be held on \", mdx(\"strong\", {\n    parentName: \"p\"\n  }, \"Thursday, August 19th\"), \".\"), mdx(\"p\", null, mdx(\"strong\", {\n    parentName: \"p\"\n  }, \"Please note:\"), \" August meetings are also held as our \\\"Annual Neighborhood Meetings\\\" and will include the formal election of the Steering Committee\\nmembers/officers.\"), mdx(\"h3\", null, \"Neighborhood Clean Up (Saturday, April 24th)\"), mdx(\"p\", null, \"The Neighborhood Association sponsored a neighborhood-wide clean up on Saturday, April 24th. Neighbors collected over 15 bags of garbage/trash between\\nthe Ferry Street Dog Park, Newell Playground, Ferry Street, and the new park between Race Street and South Michigan. Our thanks to all of the volunteers\\nthat gave part of their morning to clean up our beloved neighborhood.\"), mdx(\"p\", null, \"This collaboration with the City-wide Clean Up project provided equipment, garbage disposal and amenities for the participants that drastically simplified\\nthe planning and execution of the event. Our special thanks to Julie Booth from the Eau Claire Parks & Recreation department for all of her help and\\nsupport.\"), mdx(\"h3\", null, \"Tree Planting (Saturday, May 1st)\"), mdx(\"p\", null, \"The Neighborhood Association teamed up with the City of Eau Claire and its Forestry Department to help plant more than 400 new trees at the southwestern\\nend of the neighborhood near the Waste Water Treatment Plant. These trees replaced a large number of Ash trees that had to be removed due to the destruction\\nof the Emerald Ash Borer.\"), mdx(\"p\", null, \"The team of volunteers endured the hot sunshine of our first 80 degree day to plant species of conifers, deciduous and fruit tree. Special thanks to all of\\nour volunteers and the Forestry Supervisor from the City of Eau Claire (Matt Staudenmaier). Additional thanks to Julie Booth, the Program Supervisor with\\nEau Claire's Parks, Recreation an Forestry department for providing gloves, water and snacks for our volunteers.\"), mdx(\"h3\", null, \"Bowl for Kids' Sake (Thursday, May 6th)\"), mdx(\"p\", null, \"Members of our Neighborhood have teamed up to help support the Big Brothers Big Sisters of Northwestern Wisconsin (\", mdx(\"a\", {\n    parentName: \"p\",\n    \"href\": \"https://www.bbbsnw.org/\"\n  }, \"https://www.bbbsnw.org/\"), \") by forming a\\nteam for its annual \", mdx(\"strong\", {\n    parentName: \"p\"\n  }, \"Bowl for Kids Sake\"), \" event. We are proud to have raised over \", mdx(\"strong\", {\n    parentName: \"p\"\n  }, \"$500\"), \" and had a fantastic time bowling together as a Neighborhood.\"), mdx(\"p\", null, \"Next year we are planning to call out the other Neighborhood Associations around the City of Eau Claire for a friendly competition to see which Neighborhood\\ncan raise the most money for 2022's event!\"), mdx(\"h2\", null, \"Sub-Committees\"), mdx(\"h3\", null, \"Communications\"), mdx(\"ul\", null, mdx(\"li\", {\n    parentName: \"ul\"\n  }, \"The Information & Communications Sub-Committee has been focused on organizing, prioritizing and developing the strategies for the Neighborhood Association's\\npublic-facing website. These features will enable the Association to provide more information and multimedia for the Neighborhood's benefit and help others learn\\nmore about its history and its future.\")), mdx(\"h3\", null, \"Parks & Recreation\"), mdx(\"ul\", null, mdx(\"li\", {\n    parentName: \"ul\"\n  }, \"Assembled and executed the Neighborhood Clean-Up on April 24th.\"), mdx(\"li\", {\n    parentName: \"ul\"\n  }, \"Working with the City of Eau Claire to make improvements at Newell Playground\", mdx(\"ul\", {\n    parentName: \"li\"\n  }, mdx(\"li\", {\n    parentName: \"ul\"\n  }, \"Replacing aging shingles on the Memorial Pavilion (COMPLETED)\"), mdx(\"li\", {\n    parentName: \"ul\"\n  }, \"Replace the light switch to a timer-based switch\"), mdx(\"li\", {\n    parentName: \"ul\"\n  }, \"Added permanent basketballs\"), mdx(\"li\", {\n    parentName: \"ul\"\n  }, \"Adding additional sand around the playground equipment\"))), mdx(\"li\", {\n    parentName: \"ul\"\n  }, \"Veteran's Park Improvements\", mdx(\"ul\", {\n    parentName: \"li\"\n  }, mdx(\"li\", {\n    parentName: \"ul\"\n  }, \"Added blackberries at the Eastern edge to study how well they might grow in those conditions\"), mdx(\"li\", {\n    parentName: \"ul\"\n  }, \"Working to develop the Eastern riverfront trail\"), mdx(\"li\", {\n    parentName: \"ul\"\n  }, \"Adding garbage and recycling cans at the Race Street entrance\")))), mdx(\"h2\", null, \"Neighborhood Updates\"), mdx(\"h3\", null, \"Neighborhood-wide Thrift Sale (Satuday, May 22nd)\"), mdx(\"p\", null, \"The first annual Neighborhood-wide Thrift Sale is scheduled for \", mdx(\"strong\", {\n    parentName: \"p\"\n  }, \"Saturday, May 22nd\"), \" from \", mdx(\"strong\", {\n    parentName: \"p\"\n  }, \"8:00 am to 4:00 pm\"), \". Neighbors are invited to\\n\", mdx(\"a\", {\n    parentName: \"p\",\n    \"href\": \"http://go.shawtown.org/thriftsale/register\"\n  }, \"register\"), \" their personal thrift sale to be included in both the printed and\\n\", mdx(\"a\", {\n    parentName: \"p\",\n    \"href\": \"http://go.shawtown.org/thriftsale/map\"\n  }, \"virtual/interactive maps\"), \" that are then provided to shoppers.\"), mdx(\"p\", null, \"The Association will be advertising these thrift sales for the entire Chippewa Valley through various channels to maximize the number of shoppers\\nlearning about the thrift sales in our Neighborhood.\"), mdx(\"h4\", null, \"Register Your Thrift Sale\"), mdx(\"p\", null, \"(\", mdx(\"a\", {\n    parentName: \"p\",\n    \"href\": \"http://go.shawtown.org/thriftsale/register\"\n  }, \"http://go.shawtown.org/thriftsale/register\"), \")\"), mdx(\"p\", null, mdx(\"strong\", {\n    parentName: \"p\"\n  }, \"Please note:\"), \" You must register by Thursday, May 20th to be included on the printed map.\"), mdx(\"h4\", null, \"Interactive Map\"), mdx(\"p\", null, \"(\", mdx(\"a\", {\n    parentName: \"p\",\n    \"href\": \"http://go.shawtown.org/thriftsale/map\"\n  }, \"http://go.shawtown.org/thriftsale/map\"), \")\"), mdx(\"h4\", null, \"Important Information\"), mdx(\"ul\", null, mdx(\"li\", {\n    parentName: \"ul\"\n  }, \"Participants will be holding their own thrift sale, not be participating in one large/centralized thrift sale.\"), mdx(\"li\", {\n    parentName: \"ul\"\n  }, \"Printed maps will be made available at River Country Cooperative (Corner of Ferry Street and Menomonie Street). We will also disperse printed\\nmaps to many of the neighbors that are participating.\"), mdx(\"li\", {\n    parentName: \"ul\"\n  }, \"Physical signs will be posted in the following locations:\", mdx(\"ul\", {\n    parentName: \"li\"\n  }, mdx(\"li\", {\n    parentName: \"ul\"\n  }, \"Corner of Menomonie Street and Clairemont Avenue\"), mdx(\"li\", {\n    parentName: \"ul\"\n  }, \"Corner of Short Street and Highway 37\"))), mdx(\"li\", {\n    parentName: \"ul\"\n  }, \"Participating neighbors may elect to be open on days leading and prior to the Saturday event.\"), mdx(\"li\", {\n    parentName: \"ul\"\n  }, \"Neighbors who are interested in accepting credit cards or digital payments can reach out to the planning team for assistance.\")), mdx(\"h3\", null, \"Upcoming Elections\"), mdx(\"p\", null, \"Per the Bylaws of the Shawtown Neighborhood Assocation, the current Steering Committee's terms will expire in August of 2021. The Steering Committee is\\ncomprised of nine (9) voting members. Of these nine (9) members, four (4) are members-at-large and five (5) are officers.\"), mdx(\"p\", null, \"The daily affairs of the Association will be managed and voted on by an elected Steering Committee which shall have authority concerning the activities of\\nthe Association. This Committee will represent the geographic areas of the Association and continually review its representation of the gender and racial\\ndiversity of the neighborhood. The Steering Committee will carefully listen to its neighbors and weigh their input.\"), mdx(\"p\", null, \"At least 1 month (30 days) prior to the Annual meeting, the Steering Committee shall choose up to three (3) voting members to serve as a nominating\\ncommittee to gather names for the election of Steering Committee members. Any member of the Association may nominate someone to serve as a Steering\\nCommittee member. These nominations must be made with the approval of the person being nominated. Further nominations may be made from the floor.\\nNominations from the floor must be made with the approval of the person being nominated.\"), mdx(\"p\", null, \"Steering Committee members may be elected by ballot or show of hands. If there are more members running than there are open seats, the election will\\nbe by ballot. The top vote getters will receive the seats on the Steering Committee. If there are no contested seats, the election may be by unanimous\\nacceptance of the nominations. Any seats that were filled from unexpired terms will be filled in the way described in Section 4. Votes and ballots\\nwill be counted by the Secretary and one other person or by any two persons designated by the President.\"), mdx(\"p\", null, \"Members are defined as follows:\"), mdx(\"ul\", null, mdx(\"li\", {\n    parentName: \"ul\"\n  }, \"All resident property owners, resident renters, and absentee residential property owners within the boundaries of the Shawtown Neighborhood Association qualify as voting members of the Association.\"), mdx(\"li\", {\n    parentName: \"ul\"\n  }, \"All businesses, schools, and churches in the neighborhood qualify as nonvoting associate members of the Association.\"), mdx(\"li\", {\n    parentName: \"ul\"\n  }, \"To qualify as a voting member, one must be at least 18 years of age.\"), mdx(\"li\", {\n    parentName: \"ul\"\n  }, \"The Shawtown Neighborhood Association and its members will not discriminate against any individual or group based on race, religion, sex, sexual orientation, gender identity,\\nage, disability, legal citizenship, income, or political affiliation in any policies, recommendations, or actions.\")), mdx(\"p\", null, \"Qualifications of the Steering Committee\"), mdx(\"ol\", null, mdx(\"li\", {\n    parentName: \"ol\"\n  }, \"The Steering Committee shall consist of nine (9) voting members of the Association. Of these nine (9) members, four (4) are members-at-large and\\nfive (5) are officers. Steering Committee members will be elected by the Association members at the annual meeting.\"), mdx(\"li\", {\n    parentName: \"ol\"\n  }, \"At the end of the two (2) year term at the annual meeting, the Steering Committee members will be elected or re-elected to their two-year term.\\nWithin thirty (30) days of the annual meeting the Steering Committee will convene to elect officers for the Neighborhood Association from within the Steering Committee members.\"), mdx(\"li\", {\n    parentName: \"ol\"\n  }, \"Any member of the Steering Committee may resign at any time by giving written\\nnotice to the Steering Committee.\"), mdx(\"li\", {\n    parentName: \"ol\"\n  }, \"There are no term limits for the Steering Committee.\"), mdx(\"li\", {\n    parentName: \"ol\"\n  }, \"Only Voting Members who are residents of the Shawtown Neighborhood Association\\nmay be elected to the Steering Committee.\"), mdx(\"li\", {\n    parentName: \"ol\"\n  }, \"A Steering Committee member or officer of the Shawtown Neighborhood\\nAssociation may not make commitments on behalf of the Association without\\nauthorization by the Steering Committee. If an unauthorized commitment is made by a\\nmember or officer, that member or officer may be removed by a majority vote of the\\nSteering Committee. Furthermore, any unauthorized commitment, financial or\\notherwise, is the sole responsibility of that member or officer.\"), mdx(\"li\", {\n    parentName: \"ol\"\n  }, \"To protect the integrity of the Association\\u2019s decision-making process, Steering\\nCommittee members and officers will disclose to the Association any interest they have\\nin a transaction or decision of the Committee that may result in a financial benefit or\\ngain to them and/or their business, family members and/or significant other, employer\\nor close associates, and nonprofit organizations with which they are affiliated. Failure to\\ndisclose such interests may be grounds for removal.\"), mdx(\"li\", {\n    parentName: \"ol\"\n  }, \"One person per household may serve on the Steering Committee at a time.\")));\n}\n;\nMDXContent.isMDXComponent = true;"}},"pageContext":{"slug":"/meetings/agendas/2021/May/20/Quarterly-Neighborhood/"}},"staticQueryHashes":[]}