{"componentChunkName":"component---src-templates-meeting-agenda-tsx","path":"/meetings/agendas/2021/April/15/Steering-Committee/","result":{"data":{"mdx":{"frontmatter":{"starts":"04-15-2021 07:00 PM","ends":"04-15-2021 08:30 PM","type":"Steering Committee","location":"Virtual (Zoom Meeting)","meetingID":"845 6330 0934","meetingPasscode":762,"meetingPhone":"+1 312 626 6799","meetingUrl":"https://us02web.zoom.us/j/84563300934?pwd=cXVuMEtoWU04THdwV0dUUEpucjRNQT09","author":"Brad Candell"},"body":"function _extends() { _extends = Object.assign || function (target) { for (var i = 1; i < arguments.length; i++) { var source = arguments[i]; for (var key in source) { if (Object.prototype.hasOwnProperty.call(source, key)) { target[key] = source[key]; } } } return target; }; return _extends.apply(this, arguments); }\n\nfunction _objectWithoutProperties(source, excluded) { if (source == null) return {}; var target = _objectWithoutPropertiesLoose(source, excluded); var key, i; if (Object.getOwnPropertySymbols) { var sourceSymbolKeys = Object.getOwnPropertySymbols(source); for (i = 0; i < sourceSymbolKeys.length; i++) { key = sourceSymbolKeys[i]; if (excluded.indexOf(key) >= 0) continue; if (!Object.prototype.propertyIsEnumerable.call(source, key)) continue; target[key] = source[key]; } } return target; }\n\nfunction _objectWithoutPropertiesLoose(source, excluded) { if (source == null) return {}; var target = {}; var sourceKeys = Object.keys(source); var key, i; for (i = 0; i < sourceKeys.length; i++) { key = sourceKeys[i]; if (excluded.indexOf(key) >= 0) continue; target[key] = source[key]; } return target; }\n\n/* @jsxRuntime classic */\n\n/* @jsx mdx */\nvar _frontmatter = {\n  \"starts\": \"04-15-2021 07:00 PM\",\n  \"ends\": \"04-15-2021 08:30 PM\",\n  \"type\": \"Steering Committee\",\n  \"location\": \"Virtual (Zoom Meeting)\",\n  \"author\": \"Brad Candell\",\n  \"meetingID\": \"845 6330 0934\",\n  \"meetingPasscode\": 762,\n  \"meetingPhone\": \"+1 312 626 6799\",\n  \"meetingUrl\": \"https://us02web.zoom.us/j/84563300934?pwd=cXVuMEtoWU04THdwV0dUUEpucjRNQT09\"\n};\nvar layoutProps = {\n  _frontmatter: _frontmatter\n};\nvar MDXLayout = \"wrapper\";\nreturn function MDXContent(_ref) {\n  var components = _ref.components,\n      props = _objectWithoutProperties(_ref, [\"components\"]);\n\n  return mdx(MDXLayout, _extends({}, layoutProps, props, {\n    components: components,\n    mdxType: \"MDXLayout\"\n  }), mdx(\"ol\", null, mdx(\"li\", {\n    parentName: \"ol\"\n  }, \"Welcome & Call to Order\"), mdx(\"li\", {\n    parentName: \"ol\"\n  }, \"Roll Call\"), mdx(\"li\", {\n    parentName: \"ol\"\n  }, \"Reports\", mdx(\"ol\", {\n    parentName: \"li\"\n  }, mdx(\"li\", {\n    parentName: \"ol\"\n  }, \"Finance\"), mdx(\"li\", {\n    parentName: \"ol\"\n  }, \"Website\"), mdx(\"li\", {\n    parentName: \"ol\"\n  }, \"Articles of Incorporation - 501(c)(3)\"))), mdx(\"li\", {\n    parentName: \"ol\"\n  }, \"New Business\", mdx(\"ol\", {\n    parentName: \"li\"\n  }, mdx(\"li\", {\n    parentName: \"ol\"\n  }, \"Neighborhood thrift sale\"), mdx(\"li\", {\n    parentName: \"ol\"\n  }, \"Neighborhood Donation Drive - Helping the victims of a recent home fire\"), mdx(\"li\", {\n    parentName: \"ol\"\n  }, \"Trail Building Event\"), mdx(\"li\", {\n    parentName: \"ol\"\n  }, \"Election\"))), mdx(\"li\", {\n    parentName: \"ol\"\n  }, \"Motions\", mdx(\"ol\", {\n    parentName: \"li\"\n  }, mdx(\"li\", {\n    parentName: \"ol\"\n  }, \"Approval of previous meeting minutes\"), mdx(\"li\", {\n    parentName: \"ol\"\n  }, \"Approval of standardized list of Holidays\"))), mdx(\"li\", {\n    parentName: \"ol\"\n  }, \"Reminders\", mdx(\"ol\", {\n    parentName: \"li\"\n  }, mdx(\"li\", {\n    parentName: \"ol\"\n  }, \"Spring Clean Up Event\"), mdx(\"li\", {\n    parentName: \"ol\"\n  }, \"Bowl for Kids' Sake\"), mdx(\"li\", {\n    parentName: \"ol\"\n  }, \"Tree Planting Event\"))), mdx(\"li\", {\n    parentName: \"ol\"\n  }, \"Adjournment\")), mdx(\"h2\", null, \"New Business\"), mdx(\"h3\", null, \"Neighborhood Thrift Sale\"), mdx(\"p\", null, \"Many Eau Claire-area Neigborhood Associations hold annual garage/thrift sales as a benefit to its Neigborhood and the overall community. The advantage of a\\nNeighborhood-sponsored event means more advertising and potentially larger numbers of shoppers in attendance. Typically residents apply in advance (although not required),\\nso that their address and other information may be included on advertising details, and a map/flyer.\"), mdx(\"p\", null, \"The Shawtown Neighborhood would benefit from coordinating such an event by raising awareness of the Neighborhood and its Assocation and by generating positive \\\"traffic\\\"\\nto the area.\"), mdx(\"p\", null, \"The Eastside Hill Neighborhood Association has planned their Neighborhood-wide Thrift Sale on \", mdx(\"strong\", {\n    parentName: \"p\"\n  }, \"Saturday, May 15th, 2021\"), \". More information can be found here:\"), mdx(\"p\", null, mdx(\"a\", {\n    parentName: \"p\",\n    \"href\": \"http://eastsidehill.com/archives/5594\"\n  }, \"http://eastsidehill.com/archives/5594\")), mdx(\"h3\", null, \"Neighborhood Donation Drive\"), mdx(\"p\", null, \"On \", mdx(\"strong\", {\n    parentName: \"p\"\n  }, \"Saturday, April 10th\"), \" a resident of our Neighborhood lost nearly everything to a fire. The family has 3 children and will be in need of houseware items and\\nclothing once they have a location for which they can store whatever items are donated.\"), mdx(\"p\", null, mdx(\"a\", {\n    parentName: \"p\",\n    \"href\": \"https://wqow.com/2021/04/10/fire-breaks-out-at-trailer-home-on-revere-street/\"\n  }, \"https://wqow.com/2021/04/10/fire-breaks-out-at-trailer-home-on-revere-street/\")), mdx(\"p\", null, \"Brad Candell has been in contact with the family and would like to coordinate a \\\"Neighborhood Donation Drive\\\" when the family is ready to receive such goods.\"), mdx(\"h3\", null, \"Trail Building Event\"), mdx(\"p\", null, \"Brad Candell is looking to schedule and hold a trail building event at the Lumber Mill Park now that most of the floodwaters seem to have passed. He will be\\nlooking for a date and volunteers to build the first part of the trail, extending just east of the mouth of Sherman Creek to the eastern most boundaries of the\\nproperty.\"), mdx(\"h3\", null, \"Upcoming Elections\"), mdx(\"p\", null, \"A reminder to the Steering Committee members that per our Bylaws, each of our terms are due to expire in August of 2021 (with the exception of Erin Shadbolt).\\nThe Steering Committee must begin preparing for the nomination and election processes that we will advertise and follow when it comes time for election and/or\\npotential re-elections.\"), mdx(\"h2\", null, \"Motions\"), mdx(\"h3\", null, \"Approval of Previous Meeting Minutes\"), mdx(\"p\", null, \"Currently pending receipt of the minutes from the 3/15/2021 Steering Committee meeting.\"), mdx(\"h3\", null, \"Approval of Standardized List of Holiday/Events to Promote\"), mdx(\"p\", null, \"During a previous meeting the Steering Committee discussed the annual events and Holidays that the Association would recognize through its\\nsocial media channels. We are looking to create a motion to approve the following list, or a variation of it so that it can be properly planned\\nthrough the \", mdx(\"strong\", {\n    parentName: \"p\"\n  }, \"Information & Communications\"), \" Sub-Committee.\"), mdx(\"ul\", null, mdx(\"li\", {\n    parentName: \"ul\"\n  }, \"New Year's\"), mdx(\"li\", {\n    parentName: \"ul\"\n  }, \"Martin Luther King, Jr. Day\"), mdx(\"li\", {\n    parentName: \"ul\"\n  }, \"Chinese New Year\"), mdx(\"li\", {\n    parentName: \"ul\"\n  }, \"Valentine's Day\"), mdx(\"li\", {\n    parentName: \"ul\"\n  }, \"President's Day\"), mdx(\"li\", {\n    parentName: \"ul\"\n  }, \"Random Acts of Kindness Day\"), mdx(\"li\", {\n    parentName: \"ul\"\n  }, \"Daylight Savings\"), mdx(\"li\", {\n    parentName: \"ul\"\n  }, \"St. Patricks Day\"), mdx(\"li\", {\n    parentName: \"ul\"\n  }, \"Earth Day\"), mdx(\"li\", {\n    parentName: \"ul\"\n  }, \"Arbor Day\"), mdx(\"li\", {\n    parentName: \"ul\"\n  }, \"Cinco de Mayo\"), mdx(\"li\", {\n    parentName: \"ul\"\n  }, \"Memorial Day\"), mdx(\"li\", {\n    parentName: \"ul\"\n  }, \"Mother's Day\"), mdx(\"li\", {\n    parentName: \"ul\"\n  }, \"Flag Day\"), mdx(\"li\", {\n    parentName: \"ul\"\n  }, \"Father's Day\"), mdx(\"li\", {\n    parentName: \"ul\"\n  }, \"Independence Day\"), mdx(\"li\", {\n    parentName: \"ul\"\n  }, \"Labor Day\"), mdx(\"li\", {\n    parentName: \"ul\"\n  }, \"National Dog Day\"), mdx(\"li\", {\n    parentName: \"ul\"\n  }, \"National Good Neighbor Day\"), mdx(\"li\", {\n    parentName: \"ul\"\n  }, \"Halloween\"), mdx(\"li\", {\n    parentName: \"ul\"\n  }, \"Daylight Savings Time Ends\"), mdx(\"li\", {\n    parentName: \"ul\"\n  }, \"Veteran's Day\"), mdx(\"li\", {\n    parentName: \"ul\"\n  }, \"Hmong New Year\"), mdx(\"li\", {\n    parentName: \"ul\"\n  }, \"World Kindness Day\"), mdx(\"li\", {\n    parentName: \"ul\"\n  }, \"Thanksgiving\"), mdx(\"li\", {\n    parentName: \"ul\"\n  }, \"Hanukkah\"), mdx(\"li\", {\n    parentName: \"ul\"\n  }, \"Christmas\"), mdx(\"li\", {\n    parentName: \"ul\"\n  }, \"Ramadan\"), mdx(\"li\", {\n    parentName: \"ul\"\n  }, \"Diwali\"), mdx(\"li\", {\n    parentName: \"ul\"\n  }, \"Wisconsin State, County and City Voting Events\")), mdx(\"p\", null, \"Ideas for other days of recognition and Holidays can be found here:\"), mdx(\"p\", null, mdx(\"a\", {\n    parentName: \"p\",\n    \"href\": \"https://www.clearvoice.com/blog/social-media-calendar-hashtag-holidays/\"\n  }, \"https://www.clearvoice.com/blog/social-media-calendar-hashtag-holidays/\")), mdx(\"h2\", null, \"Reminders\"), mdx(\"h3\", null, \"Spring Clean Up Event\"), mdx(\"p\", null, \"The \", mdx(\"strong\", {\n    parentName: \"p\"\n  }, \"Spring Clean Up\"), \" event is planned for \", mdx(\"strong\", {\n    parentName: \"p\"\n  }, \"Saturday, April 24th\"), \" from \", mdx(\"strong\", {\n    parentName: \"p\"\n  }, \"9:00 am to 12:00 pm\"), \". Volunteers from the Shawtown Neighborhood should specify\\nsuch and complete the required forms by Friday, April 16th.\"), mdx(\"p\", null, mdx(\"a\", {\n    parentName: \"p\",\n    \"href\": \"https://www.eauclairewi.gov/home/showpublisheddocument?id=35093&fbclid=IwAR2BaLo4Do-bifPhQF7Fo7_ym8pwIyQHPvSpsnBM-WJo-E6AP4YGEi8l0TM\"\n  }, \"Volunteer Form\")), mdx(\"h3\", null, \"Bowl for Kids' Sake\"), mdx(\"p\", null, \"The Shawtown Neighborhood Association is still looking to put together a team for Big Brothers / Big Sisters Bowl for Kids' Sake event.\"), mdx(\"p\", null, \"More information can be found here: \", mdx(\"a\", {\n    parentName: \"p\",\n    \"href\": \"https://www.bbbsnw.org/bfks\"\n  }, \"https://www.bbbsnw.org/bfks\")), mdx(\"h3\", null, \"Tree Planting Event\"), mdx(\"p\", null, \"Brad Candell is still working with the Parks & Forestry Departments to coordinate and plan a Tree Planting event at the southern end of Ferry Street, near the Dog Park.\"));\n}\n;\nMDXContent.isMDXComponent = true;"}},"pageContext":{"slug":"/meetings/agendas/2021/April/15/Steering-Committee/"}},"staticQueryHashes":[]}